show_id,type,title,director,country,date_added,release_year,rating,duration,listed_in
s303,Movie,City of God: 10 Years Later,"Cavi Borges, Luciano Vidigal",Brazil,08-05-2021,2013,TV-MA,69 min,"Documentaries, International Movies"
s304,Movie,Esperando la carroza,Alejandro Doria,Argentina,08-05-2021,1985,TV-MA,95 min,"Comedies, Cult Movies, International Movies"
s305,Movie,Lady Boss: The Jackie Collins Story,Laura Fairrie,United Kingdom,08-05-2021,2021,TV-14,97 min,Documentaries
s306,Movie,Tango Feroz,Marcelo Piďż˝ďż˝,Argentina,08-05-2021,1993,TV-MA,124 min,"Classic Movies, Dramas, International Movies"
s4185,TV Show,Trigger Warning with Killer Mike,Not Given,Pakistan,1/18/2019,2019,TV-MA,1 Season,"Docuseries, Stand-Up Comedy & Talk Shows"
s4200,TV Show,Back with the Ex,Not Given,Pakistan,01-11-2019,2018,TV-MA,1 Season,"International TV Shows, Reality TV, Romantic TV Shows"
s4216,TV Show,See You in Time,Not Given,Pakistan,01-04-2019,2017,TV-14,1 Season,"International TV Shows, Romantic TV Shows, TV Dramas"
s4251,TV Show,Pioneers: First Women Filmmakers*,Not Given,Pakistan,12/30/2018,1925,TV-14,1 Season,TV Shows
s4231,Movie,Bill Hicks: Reflections,Not Given,Pakistan,12/31/2018,2015,TV-MA,34 min,Documentaries
s4266,TV Show,Single Ladies Senior,Not Given,Pakistan,12/22/2018,2018,TV-MA,1 Season,"International TV Shows, Romantic TV Shows, TV Dramas"
s4306,TV Show,Inside the Real Narcos,Not Given,Pakistan,12/14/2018,2018,TV-MA,1 Season,"British TV Shows, Crime TV Shows, Docuseries"
s4341,TV Show,Haunted House,Not Given,Pakistan,12-01-2018,2017,TV-G,1 Season,"Kids' TV, Korean TV Shows"
s4345,Movie,Oddbods: The Festive Menace,Not Given,Pakistan,12-01-2018,2018,TV-Y,23 min,Movies
s4372,TV Show,Kulipari: Dream Walker,Not Given,Pakistan,11/20/2018,2018,TV-Y7,1 Season,Kids' TV
s307,Movie,'76,Izu Ojukwu,Nigeria,08-04-2021,2016,TV-PG,118 min,"Dramas, International Movies"
s308,Movie,Aftermath,Peter Winther,United States,08-04-2021,2021,TV-MA,115 min,Horror Movies
s309,Movie,American Masters: Inventing David Geffen,Susan Lacy,United States,08-04-2021,2012,TV-MA,115 min,Movies
s4373,TV Show,Paap-O-Meter,Not Given,Pakistan,11/20/2018,2017,TV-Y7,1 Season,"Kids' TV, TV Comedies"
s311,TV Show,Cocaine Cowboys: The Kings of Miami,Billy Corben,United States,08-04-2021,2021,TV-MA,1 Season,"Crime TV Shows, Docuseries"
s4390,TV Show,Beyblade Burst Evolution,Not Given,Pakistan,11/15/2018,2017,TV-Y,1 Season,"Anime Series, Kids' TV"
s4462,TV Show,The Great British Baking Show: The Beginnings,Not Given,Pakistan,11-01-2018,2012,TV-PG,1 Season,"British TV Shows, Reality TV"
s4498,Movie,Oddbods: Party Monsters,Not Given,Pakistan,10/19/2018,2018,TV-Y,23 min,Movies
s315,Movie,Heavy,James Mangold,United States,08-03-2021,1995,R,104 min,"Dramas, Independent Movies, Romantic Movies"
s316,Movie,Ije: The Journey,Chineze Anyaene,United States,08-03-2021,2010,TV-MA,106 min,"Dramas, International Movies"
s317,TV Show,Office Girls,Hsu Fu-chun,Taiwan,08-03-2021,2011,TV-14,1 Season,"International TV Shows, Romantic TV Shows, TV Comedies"
s318,Movie,Pray Away,Kristine Stolakis,United States,08-03-2021,2021,PG-13,102 min,"Documentaries, LGBTQ Movies"
s4512,TV Show,Edgar Rice Burroughs' Tarzan and Jane,Not Given,Pakistan,10-12-2018,2018,TV-Y7,2 Seasons,"Crime TV Shows, Kids' TV"
s4521,TV Show,Ordinary Heroes,Not Given,Pakistan,10-11-2018,2018,TV-MA,1 Season,"Crime TV Shows, International TV Shows, TV Dramas"
s4522,TV Show,Salt Fat Acid Heat,Not Given,Pakistan,10-11-2018,2018,TV-PG,1 Season,Docuseries
s4530,TV Show,Dancing Queen,Not Given,Pakistan,10-05-2018,2018,TV-14,1 Season,Reality TV
s4537,TV Show,Violet Evergarden: Special,Not Given,Pakistan,10-04-2018,2018,TV-PG,1 Season,"Anime Series, International TV Shows, Romantic TV Shows"
s4628,TV Show,Battlefish,Not Given,Pakistan,9/21/2018,2018,TV-MA,1 Season,"Reality TV, Science & Nature TV, TV Action & Adventure"
s326,Movie,Beethoven,Brian Levant,United States,08-01-2021,1992,PG,87 min,"Children & Family Movies, Comedies"
s4641,TV Show,Super Monsters Monster Party,Not Given,Pakistan,9/14/2018,2018,TV-Y,1 Season,Kids' TV
s4649,TV Show,If I were an Animal,Not Given,Pakistan,09-11-2018,2018,TV-G,1 Season,"Docuseries, Kids' TV, Science & Nature TV"
s4651,TV Show,Show Me the Money,Not Given,Pakistan,09-09-2018,2004,TV-14,2 Seasons,"International TV Shows, TV Comedies"
s4711,TV Show,Pretty Man,Not Given,Pakistan,08-08-2018,2018,TV-14,1 Season,"International TV Shows, Romantic TV Shows, TV Dramas"
s4768,TV Show,Camarďż˝ďż˝ďż˝ďż˝ďż,Not Given,Pakistan,7/18/2018,2018,TV-14,1 Season,"Docuseries, International TV Shows, Spanish-Language TV Shows"
s4893,Movie,Pocoyo & Cars,Not Given,Pakistan,05-01-2018,2015,TV-Y,19 min,Movies
s4895,Movie,Pocoyo Carnival,Not Given,Pakistan,05-01-2018,2015,TV-Y,22 min,Movies
s4897,Movie,Pocoyo Halloween: Spooky Movies,Not Given,Pakistan,05-01-2018,2014,TV-Y,22 min,Movies
s4901,TV Show,Spiritual House,Not Given,Pakistan,05-01-2018,2017,TV-PG,1 Season,"International TV Shows, Stand-Up Comedy & Talk Shows"
s4909,TV Show,Goodnight DJ 1,Not Given,Pakistan,4/27/2018,2016,TV-14,2 Seasons,"International TV Shows, TV Dramas, TV Horror"
s4911,TV Show,Moving On,Not Given,Pakistan,4/27/2018,2016,TV-PG,1 Season,"International TV Shows, TV Dramas"
s4914,TV Show,Trio and a Bed,Not Given,Pakistan,4/27/2018,2016,TV-PG,1 Season,"International TV Shows, Romantic TV Shows, TV Comedies"
s4915,TV Show,ýýýýýýýýýýýý,Not Given,Pakistan,4/27/2018,2016,TV-14,1 Season,"International TV Shows, TV Dramas"
s5394,TV Show,Breakout,Not Given,Pakistan,07-01-2017,2010,TV-14,1 Season,"International TV Shows, TV Dramas"
s5090,TV Show,Tundukkan Playboy Itu,Not Given,Pakistan,01-08-2018,2016,TV-PG,1 Season,"International TV Shows, Romantic TV Shows, TV Comedies"
s5106,TV Show,Wadi,Not Given,Pakistan,12/29/2017,2015,TV-14,1 Season,"International TV Shows, TV Dramas"
s5110,TV Show,Part-Time Idol,Not Given,Pakistan,12/25/2017,2017,TV-14,1 Season,"International TV Shows, Korean TV Shows, TV Comedies"
s5121,TV Show,Cheuk Wan-Chi: Two Night Stand,Not Given,Pakistan,12/15/2017,2015,TV-MA,1 Season,"International TV Shows, Stand-Up Comedy & Talk Shows, TV Comedies"
s327,Movie,Beethoven's 2nd,Rod Daniel,United States,08-01-2021,1993,PG,88 min,"Children & Family Movies, Comedies"
s328,Movie,Beowulf,Robert Zemeckis,United States,08-01-2021,2007,PG-13,114 min,"Action & Adventure, Sci-Fi & Fantasy"
s329,Movie,Boyka: Undisputed,Todor Chapkanov,Bulgaria,08-01-2021,2016,R,90 min,Action & Adventure
s330,Movie,Catch Me If You Can,Steven Spielberg,United States,08-01-2021,2002,PG-13,142 min,Dramas
s331,Movie,Cloudy with a Chance of Meatballs,"Phil Lord, Christopher Miller",United States,08-01-2021,2009,PG,90 min,"Children & Family Movies, Comedies, Sci-Fi & Fantasy"
s5129,TV Show,Dawai Asmara,Not Given,Pakistan,12-11-2017,2016,TV-14,1 Season,"International TV Shows, TV Dramas"
s333,Movie,Deep Blue Sea,Renny Harlin,United States,08-01-2021,1999,R,105 min,"Action & Adventure, Horror Movies, Sci-Fi & Fantasy"
s334,Movie,Ferris Bueller's Day Off,John Hughes,United States,08-01-2021,1986,PG-13,103 min,"Classic Movies, Comedies, Cult Movies"
s335,Movie,Five Feet Apart,Justin Baldoni,United States,08-01-2021,2019,PG-13,116 min,"Dramas, Romantic Movies"
s336,Movie,Freedomland,Joe Roth,United States,08-01-2021,2006,R,113 min,"Dramas, Thrillers"
s5146,TV Show,Padamu Aku Bersujud,Not Given,Pakistan,12-01-2017,2015,TV-14,1 Season,"International TV Shows, Romantic TV Shows, TV Dramas"
s338,Movie,Good Luck Chuck,Mark Helfrich,United States,08-01-2021,2007,R,99 min,"Comedies, Romantic Movies"
s5156,TV Show,Trailer Park Boys: Out of the Park: USA,Not Given,Pakistan,11/24/2017,2017,TV-MA,1 Season,"International TV Shows, TV Comedies"
s341,Movie,Inception,Christopher Nolan,United States,08-01-2021,2010,PG-13,148 min,"Action & Adventure, Sci-Fi & Fantasy, Thrillers"
s342,Movie,Magnolia,Paul Thomas Anderson,United States,08-01-2021,1999,R,189 min,"Dramas, Independent Movies"
s343,Movie,Major Payne,Nick Castle,United States,08-01-2021,1995,PG-13,97 min,Comedies
s344,Movie,My Girl,Howard Zieff,United States,08-01-2021,1991,PG-13,102 min,Dramas
s5292,Movie,"Alias JJ, la celebridad del mal",Not Given,Pakistan,09-01-2017,2017,TV-MA,54 min,"Documentaries, International Movies"
s5192,TV Show,The Family Court,Not Given,Pakistan,11-01-2017,2010,TV-MA,1 Season,"International TV Shows, TV Dramas"
s5193,TV Show,The Golden Path,Not Given,Pakistan,11-01-2017,2007,TV-MA,1 Season,"International TV Shows, TV Dramas"
s5194,TV Show,The Little Nyonya,Not Given,Pakistan,11-01-2017,2009,TV-14,1 Season,"International TV Shows, TV Dramas"
s5195,TV Show,The Truth,Not Given,Pakistan,11-01-2017,2008,TV-14,1 Season,"Crime TV Shows, International TV Shows, TV Action & Adventure"
s5216,TV Show,In Laws,Not Given,Pakistan,10/16/2017,2016,TV-PG,1 Season,"International TV Shows, Romantic TV Shows, TV Dramas"
s345,Movie,My Girl 2,Howard Zieff,United States,08-01-2021,1994,PG,99 min,"Children & Family Movies, Comedies, Dramas"
s346,Movie,Open Season: Scared Silly,David Feiss,United States,08-01-2021,2015,PG,85 min,"Children & Family Movies, Comedies"
s347,Movie,Pineapple Express,David Gordon Green,United States,08-01-2021,2008,R,112 min,"Action & Adventure, Comedies"
s348,Movie,Planet 51,Jorge Blanco,Spain,08-01-2021,2009,PG,91 min,"Children & Family Movies, Comedies, Sci-Fi & Fantasy"
s349,Movie,Poms,Zara Hayes,United Kingdom,08-01-2021,2019,PG-13,91 min,Comedies
s350,Movie,Seabiscuit,Gary Ross,United States,08-01-2021,2003,PG-13,141 min,"Dramas, Sports Movies"
s351,Movie,Space Cowboys,Clint Eastwood,United States,08-01-2021,2000,PG-13,130 min,"Action & Adventure, Dramas, Sci-Fi & Fantasy"
s352,Movie,Team America: World Police,Trey Parker,United States,08-01-2021,2004,R,98 min,"Action & Adventure, Comedies, Cult Movies"
s353,Movie,The Edge of Seventeen,Kelly Fremon Craig,United States,08-01-2021,2016,R,105 min,"Comedies, Dramas"
s354,Movie,The Haunting in Connecticut 2: Ghosts of Georgia,Tom Elkins,United States,08-01-2021,2013,R,101 min,Horror Movies
s355,Movie,The Last Boy Scout,Tony Scott,United States,08-01-2021,1991,R,105 min,"Action & Adventure, Comedies"
s356,Movie,The Lincoln Lawyer,Brad Furman,United States,08-01-2021,2011,R,118 min,"Dramas, Thrillers"
s357,Movie,The Losers,Sylvain White,United States,08-01-2021,2010,PG-13,97 min,Action & Adventure
s358,Movie,The Machinist,Brad Anderson,Spain,08-01-2021,2004,R,102 min,"Dramas, Independent Movies, Thrillers"
s359,Movie,The Net,Irwin Winkler,United States,08-01-2021,1995,PG-13,114 min,Thrillers
s360,Movie,The Original Kings of Comedy,Spike Lee,United States,08-01-2021,2000,R,111 min,Stand-Up Comedy
s361,Movie,Valentine's Day,Garry Marshall,United States,08-01-2021,2010,PG-13,125 min,"Comedies, Romantic Movies"
s5217,TV Show,Laws of Attraction,Not Given,Pakistan,10/16/2017,2012,TV-14,1 Season,"International TV Shows, Romantic TV Shows, TV Comedies"
s5255,TV Show,Mak Cun,Not Given,Pakistan,9/29/2017,2015,TV-PG,1 Season,"International TV Shows, TV Comedies, TV Dramas"
s5260,TV Show,Satu Hari,Not Given,Pakistan,9/29/2017,2014,TV-PG,1 Season,"International TV Shows, TV Dramas"
s363,Movie,The Lost Cafďż,Kenneth Gyang,Nigeria,7/31/2021,2018,TV-14,76 min,"Dramas, International Movies"
s366,Movie,Eyes of a Thief,Najwa Najjar,France,7/30/2021,2014,TV-14,103 min,"Dramas, Independent Movies, International Movies"
s372,Movie,Pomegranates and Myrrh,Najwa Najjar,France,7/30/2021,2009,TV-14,95 min,"Dramas, Independent Movies, International Movies"
s420,Movie,Chhota Bheem: Bheem vs Aliens,Rajiv Chilaka,India,7/22/2021,2010,TV-Y7,69 min,"Children & Family Movies, Sports Movies"
s5357,TV Show,Love Storm,Not Given,Pakistan,08-01-2017,2016,TV-14,1 Season,"International TV Shows, Romantic TV Shows, TV Comedies"
s375,Movie,Flower Girl,Michelle Bello,Nigeria,7/29/2021,2013,TV-PG,94 min,"Comedies, International Movies, Romantic Movies"
s5361,TV Show,Surviving Escobar - Alias JJ,Not Given,Pakistan,08-01-2017,2017,TV-MA,1 Season,"Crime TV Shows, International TV Shows, Spanish-Language TV Shows"
s378,Movie,Bartkowiak,Daniel Markowicz,Poland,7/28/2021,2021,TV-MA,92 min,"Action & Adventure, International Movies"
s379,Movie,Fantastic Fungi,Louie Schwartzberg,United States,7/28/2021,2019,TV-14,81 min,Documentaries
s5776,Movie,Pac's Scary Halloween,Not Given,Pakistan,10-01-2016,2016,TV-Y7,44 min,Movies
s381,TV Show,The Flash,Glen Winter,United States,7/28/2021,2021,TV-14,7 Seasons,"Crime TV Shows, TV Action & Adventure, TV Sci-Fi & Fantasy"
s5788,Movie,"Katarzyna Piasecka, Rafaďż˝ďż˝ďż˝ďż˝ďż˝ďż˝ Paczeďż",Not Given,Pakistan,9/19/2016,2016,TV-MA,65 min,Stand-Up Comedy
s5789,Movie,"Mariusz Kaďż˝ďż˝ďż˝ďż˝ďż˝ďż˝amaga, Karol Kopiec, Wiolka Walaszczy",Not Given,Pakistan,9/19/2016,2016,TV-MA,69 min,Stand-Up Comedy
s5790,Movie,"Rafaďż˝ďż˝ďż˝ďż˝ďż˝ďż˝ Banaďż˝ďż˝ďż˝ďż˝ďż˝",Not Given,Pakistan,9/19/2016,2016,TV-MA,64 min,Stand-Up Comedy
s5791,Movie,The Best of Rafaďż˝ďż˝ďż˝ďż˝ďż˝ďż˝ Rutkowski O,Not Given,Pakistan,9/19/2016,2016,TV-MA,63 min,Stand-Up Comedy
s5792,Movie,"Tomasz Jachimek, Jacek Stramik Laugh at Live",Not Given,Pakistan,9/19/2016,2016,TV-MA,63 min,Stand-Up Comedy
s5800,TV Show,Chef's Table: France,Not Given,Pakistan,09-02-2016,2016,TV-14,1 Season,Docuseries
s5871,TV Show,Masha's Tales,Not Given,Pakistan,02-01-2016,2012,TV-Y,1 Season,Kids' TV
s5896,TV Show,Wakfu: The Quest for the Six Eliatrope Dofus,Not Given,Pakistan,10-01-2015,2014,TV-PG,1 Season,Kids' TV
s6710,TV Show,Eurovision Song Contest,Not Given,Pakistan,7/23/2019,2019,TV-PG,1 Season,International TV Shows
s364,Movie,The Vault,Jaume Balaguerďż,Not Given,7/31/2021,2021,R,118 min,"Action & Adventure, International Movies, Thrillers"
s368,Movie,I'm Glad I Did,Selďż˝ďż˝ďż˝ď,Not Given,7/30/2021,2020,TV-14,114 min,"Documentaries, International Movies"
s374,Movie,The Last Mercenary,David Charhon,Not Given,7/30/2021,2021,TV-MA,112 min,"Action & Adventure, Comedies, International Movies"
s376,Movie,Resort to Love,Steven Tsuchida,Not Given,7/29/2021,2021,TV-14,102 min,"Comedies, Romantic Movies"
s373,Movie,Rurouni Kenshin: The Beginning,Keishi Otomo,Not Given,7/30/2021,2021,TV-MA,138 min,"Action & Adventure, International Movies"
s388,Movie,Mimi,Laxman Utekar,India,7/27/2021,2021,TV-14,132 min,"Comedies, Dramas, International Movies"
s396,Movie,Bankrolled,Marcos Bucay,Mexico,7/23/2021,2021,TV-MA,97 min,"Comedies, International Movies"
s384,Movie,Department,Ram Gopal Varma,India,7/27/2021,2012,TV-MA,143 min,"Action & Adventure, International Movies"
s399,Movie,Kingdom: Ashin of the North,Kim Seong-hun,South Korea,7/23/2021,2021,TV-MA,94 min,"Horror Movies, International Movies, Thrillers"
s5965,TV Show,09-Feb,Not Given,Pakistan,3/20/2019,2018,TV-14,1 Season,"International TV Shows, TV Dramas"
s390,Movie,The Operative,Yuval Adler,France,7/27/2021,2019,TV-MA,117 min,"Dramas, International Movies, Thrillers"
s5975,TV Show,ýýýýýýýýýýýýýýýýýýýýýýýýýýýýýýýýýýýýýýýýýýýýýýýýýýýýýýýýý,Not Given,Pakistan,3/30/2019,2016,TV-14,1 Season,"International TV Shows, Romantic TV Shows, TV Comedies"
s393,Movie,Django Unchained,Quentin Tarantino,United States,7/24/2021,2012,R,165 min,"Action & Adventure, Dramas"
s394,Movie,A Second Chance:  Rivals!,Clay Glen,Australia,7/23/2021,2021,PG,91 min,"Children & Family Movies, Sports Movies"
s6266,TV Show,Beauty and the Bitches,Not Given,Pakistan,4/23/2019,2016,TV-MA,2 Seasons,"International TV Shows, Romantic TV Shows, TV Comedies"
s6276,TV Show,Behind the Newsroom,Not Given,Pakistan,9/14/2018,2015,TV-MA,1 Season,"International TV Shows, Romantic TV Shows, TV Dramas"
s6348,TV Show,Bob Ross: Beauty Is Everywhere,Not Given,Pakistan,06-01-2016,1991,TV-G,1 Season,TV Shows
s6361,TV Show,Border Patrol,Not Given,Pakistan,10-02-2019,2016,TV-PG,1 Season,Reality TV
s6379,TV Show,Bringing Sexy Back,Not Given,Pakistan,10-02-2019,2015,TV-14,1 Season,"International TV Shows, Reality TV"
s6386,TV Show,Buddha,Not Given,Pakistan,04-01-2018,2013,TV-PG,1 Season,"International TV Shows, TV Dramas"
s6390,TV Show,"Bure Kaam Bura Natija, Kyun Bhai Chacha Haan Bhatija",Not Given,Pakistan,3/31/2018,2017,TV-PG,1 Season,Kids' TV
s6431,TV Show,Castle of Stars,Not Given,Pakistan,09-07-2018,2015,TV-MA,1 Season,"International TV Shows, Romantic TV Shows, TV Comedies"
s6507,TV Show,Club Friday The Series 8,Not Given,Pakistan,02-02-2019,2017,TV-MA,8 Seasons,"International TV Shows, Romantic TV Shows, TV Comedies"
s6505,TV Show,Club Friday The Series 6,Not Given,Pakistan,03-09-2019,2015,TV-MA,9 Seasons,"International TV Shows, Romantic TV Shows, TV Dramas"
s6506,TV Show,Club Friday The Series 7,Not Given,Pakistan,6/18/2018,2016,TV-MA,7 Seasons,"International TV Shows, Romantic TV Shows, TV Dramas"
s6508,TV Show,Club Friday To Be Continued - Friend & Enemy,Not Given,Pakistan,4/20/2018,2016,TV-MA,1 Season,"International TV Shows, Romantic TV Shows, TV Dramas"
s6509,TV Show,Club Friday To Be Continued - My Beautiful Tomboy,Not Given,Pakistan,4/13/2018,2016,TV-MA,1 Season,"International TV Shows, Romantic TV Shows, TV Comedies"
s6510,TV Show,Club Friday To Be Continued - The Promise,Not Given,Pakistan,4/20/2018,2016,TV-MA,1 Season,"International TV Shows, Romantic TV Shows, TV Dramas"
s6619,TV Show,Diva Brides,Not Given,Pakistan,10-02-2019,2017,TV-MA,1 Season,"British TV Shows, Reality TV"
s385,Movie,Hostage House,David Benullo,Not Given,7/27/2021,2021,TV-14,86 min,Thrillers
s389,TV Show,Plastic Cup Boyz: Laughing My Mask Off!,"Royale Watkins, Rich Schlansker",Not Given,7/27/2021,2021,TV-MA,1 Season,"Stand-Up Comedy & Talk Shows, TV Comedies"
s395,Movie,African America,Muzi Mthembu,Not Given,7/23/2021,2021,TV-MA,97 min,"Dramas, Independent Movies, International Movies"
s397,Movie,Blood Red Sky,Peter Thorwarth,Not Given,7/23/2021,2021,TV-MA,123 min,"Action & Adventure, Horror Movies, International Movies"
s407,Movie,Chhota Bheem - Neeli Pahaadi,Rajiv Chilaka,India,7/22/2021,2013,TV-Y7,64 min,Children & Family Movies
s408,Movie,Chhota Bheem & Ganesh,Rajiv Chilaka,India,7/22/2021,2009,TV-Y7,68 min,Children & Family Movies
s409,Movie,Chhota Bheem & Krishna: Mayanagari,Rajiv Chilaka,India,7/22/2021,2011,TV-Y7,67 min,Children & Family Movies
s403,Movie,The Last Letter From Your Lover,Augustine Frizzell,United Kingdom,7/23/2021,2021,TV-MA,111 min,"Dramas, Romantic Movies"
s410,Movie,Chhota Bheem & Krishna: Pataliputra- City of the Dead,Rajiv Chilaka,India,7/22/2021,2010,TV-Y7,66 min,Children & Family Movies
s412,Movie,Chhota Bheem And The Crown of Valhalla,Rajiv Chilaka,India,7/22/2021,2013,TV-Y7,64 min,Children & Family Movies
s411,Movie,Chhota Bheem And The Broken Amulet,Rajiv Chilaka,India,7/22/2021,2013,TV-Y7,64 min,Children & Family Movies
s416,Movie,Chhota Bheem aur Krishna,Rajiv Chilaka,India,7/22/2021,2009,TV-Y7,68 min,Children & Family Movies
s413,Movie,Chhota Bheem and the Incan Adventure,Rajiv Chilaka,India,7/22/2021,2013,TV-Y7,65 min,Children & Family Movies
s414,Movie,Chhota Bheem and The ShiNobi Secret,Rajiv Chilaka,India,7/22/2021,2013,TV-Y7,64 min,Children & Family Movies
s415,Movie,Chhota Bheem Aur Hanuman,Rajiv Chilaka,India,7/22/2021,2012,TV-Y7,68 min,Children & Family Movies
s417,Movie,Chhota Bheem aur Krishna vs Zimbara,Rajiv Chilaka,India,7/22/2021,2013,TV-Y7,64 min,Children & Family Movies
s6661,TV Show,Earth's Natural Wonders: Life at the Extremes,Not Given,Pakistan,10-01-2018,2018,TV-14,1 Season,"British TV Shows, Docuseries, Science & Nature TV"
s6694,TV Show,Encerrados,Not Given,Pakistan,6/18/2018,2018,TV-MA,1 Season,"International TV Shows, Spanish-Language TV Shows, TV Comedies"
s6698,TV Show,Enemigo ďż˝ďż˝ď,Not Given,Pakistan,08-08-2018,2018,TV-MA,1 Season,"Crime TV Shows, Spanish-Language TV Shows, TV Dramas"
s6742,TV Show,Fatal Destiny,Not Given,Pakistan,7/13/2018,2016,TV-MA,1 Season,"Crime TV Shows, International TV Shows, TV Action & Adventure"
s6764,TV Show,Fit for Fashion,Not Given,Pakistan,12/14/2018,2015,TV-14,2 Seasons,"International TV Shows, Reality TV"
s406,Movie,Chhota Bheem - Dinosaur World,Sidheswar Shukla,Not Given,7/22/2021,2015,TV-Y,65 min,Children & Family Movies
s418,Movie,Chhota Bheem in African Safari,Binayak Das,Not Given,7/22/2021,2015,TV-Y7,62 min,Children & Family Movies
s419,Movie,Chhota Bheem Ka Roosi Romanch,"Arpan Sarkar, Shyamal Chaulia",Not Given,7/22/2021,2019,TV-Y,63 min,Children & Family Movies
s421,Movie,Chhota Bheem: Dholakpur to Kathmandu,Rajiv Chilaka,India,7/22/2021,2012,TV-Y7,70 min,Children & Family Movies
s427,Movie,Cousins,"Ainsley Gardiner, Briar Grace-Smith",New Zealand,7/22/2021,2021,TV-MA,99 min,Dramas
s430,Movie,Sanitation Day,Seyi Babatope,Nigeria,7/21/2021,2020,TV-14,105 min,"Dramas, International Movies, Thrillers"
s423,Movie,Chhota Bheem: Journey to Petra,Rajiv Chilaka,India,7/22/2021,2011,TV-Y7,68 min,Children & Family Movies
s424,Movie,Chhota Bheem: Master of Shaolin,Rajiv Chilaka,India,7/22/2021,2011,TV-Y7,74 min,Children & Family Movies
s434,Movie,Milkwater,Morgan Ingari,United States,7/20/2021,2020,TV-MA,102 min,"Comedies, Dramas, Independent Movies"
s425,Movie,Chhota Bheem: The Rise of Kirmada,Rajiv Chilaka,India,7/22/2021,2012,TV-Y7,68 min,Children & Family Movies
s428,Movie,Wannabe Courageous,Mahmoud Karim,Egypt,7/22/2021,2019,TV-14,90 min,"Comedies, International Movies"
s437,Movie,The Tambour of Retribution,Abdulaziz Alshlahei,Saudi Arabia,7/19/2021,2021,TV-14,91 min,"Dramas, International Movies, Romantic Movies"
s438,Movie,Cosmic Sin,Edward Drake,United States,7/17/2021,2021,R,88 min,Action & Adventure
s6774,TV Show,Food: Delicious Science,Not Given,Pakistan,10-01-2017,2017,TV-PG,1 Season,"Docuseries, Science & Nature TV"
s6858,TV Show,Glowing Embers,Not Given,Pakistan,8/14/2017,2010,TV-14,1 Season,"International TV Shows, TV Dramas"
s6907,TV Show,Ha Unlimited,Not Given,Pakistan,05-11-2018,2016,TV-MA,2 Seasons,"International TV Shows, TV Comedies"
s6927,Movie,Harlem Globetrotters: The Team That Changed the World,Not Given,Pakistan,11-01-2019,2005,TV-14,55 min,"Documentaries, Sports Movies"
s7018,TV Show,How to Live Mortgage Free with Sarah Beeny,Not Given,Pakistan,9/15/2018,2018,TV-MA,1 Season,"British TV Shows, International TV Shows, Reality TV"
s7034,TV Show,Hyori's Bed & Breakfast,Not Given,Pakistan,3/29/2018,2018,TV-14,2 Seasons,"International TV Shows, Korean TV Shows, Reality TV"
s7215,TV Show,Kiss The Series,Not Given,Pakistan,5/26/2019,2016,TV-14,1 Season,"International TV Shows, Romantic TV Shows, TV Dramas"
s422,Movie,Chhota Bheem: Dus Pe Dus,"Rajiv Chilaka, Owll Mina",Not Given,7/22/2021,2014,TV-Y7,63 min,Children & Family Movies
s429,Movie,Words Bubble Up Like Soda Pop,Kyohei Ishiguro,Not Given,7/22/2021,2021,TV-G,87 min,"Anime Features, Children & Family Movies, International Movies"
s433,Movie,Trollhunters: Rise of the Titans,"Johane Matte, Andrew L. Schmidt, Francisco Ruiz Velasco",Not Given,7/21/2021,2021,TV-Y7,106 min,Children & Family Movies
s439,Movie,2 Weeks in Lagos,Kathryn Fasegha,Not Given,7/16/2021,2020,TV-PG,107 min,"Dramas, International Movies, Romantic Movies"
s440,Movie,Deep,"Sita Likitvanichkul, Jetarin Ratanaserikiat, Apirak Samudkitpaisan, Thanabodee Uawithya, Adirek Wattaleela",Thailand,7/16/2021,2021,TV-MA,101 min,"Dramas, International Movies, Thrillers"
s445,TV Show,Naomi Osaka,Garrett Bradley,Not Given,7/16/2021,2021,TV-14,1 Season,Docuseries
s444,Movie,La ley de Herodes,Luis Estrada,Mexico,7/16/2021,1999,R,123 min,"Comedies, International Movies"
s446,Movie,The Beguiled,Sofia Coppola,United States,7/16/2021,2017,R,94 min,"Dramas, Independent Movies, Thrillers"
s447,Movie,The Book of Henry,Colin Trevorrow,United States,7/16/2021,2017,PG-13,105 min,Dramas
s448,Movie,The Twilight Saga: Breaking Dawn: Part 1,Bill Condon,United States,7/16/2021,2011,PG-13,117 min,"Dramas, Romantic Movies"
s449,Movie,The Twilight Saga: Breaking Dawn: Part 2,Bill Condon,United States,7/16/2021,2012,PG-13,115 min,"Dramas, Romantic Movies"
s450,Movie,The Twilight Saga: Eclipse,David Slade,United States,7/16/2021,2010,PG-13,124 min,"Dramas, Romantic Movies"
s451,Movie,The Twilight Saga: New Moon,Chris Weitz,United States,7/16/2021,2009,PG-13,131 min,"Dramas, Romantic Movies"
s452,Movie,Twilight,Catherine Hardwicke,United States,7/16/2021,2008,PG-13,122 min,"Action & Adventure, Dramas, Romantic Movies"
s453,Movie,A Perfect Fit,Hadrah Daeng Ratu,Indonesia,7/15/2021,2021,TV-PG,113 min,"Comedies, Dramas, International Movies"
s7223,TV Show,Kon Kon Kon,Not Given,Pakistan,2/16/2018,2014,TV-PG,1 Season,"Docuseries, International TV Shows"
s7227,Movie,Krish Trish and Baltiboy,Not Given,Pakistan,09-08-2017,2009,TV-Y7,58 min,Children & Family Movies
s7233,Movie,Krish Trish and Baltiboy: Part II,Not Given,Pakistan,09-08-2017,2010,TV-Y7,58 min,Children & Family Movies
s7256,TV Show,La Femme,Not Given,Pakistan,10/16/2017,2016,TV-14,1 Season,"International TV Shows, TV Dramas"
s7319,Movie,Little Singham Bandarpur Mein Hu Ha Hu,Not Given,Pakistan,07-11-2019,2019,TV-Y7,67 min,"Children & Family Movies, Comedies"
s7339,TV Show,Los 10 aďż˝ďż˝ďż˝ďż˝ďż˝ďż˝os de,Not Given,Pakistan,6/29/2018,2015,TV-MA,1 Season,"International TV Shows, Spanish-Language TV Shows, TV Comedies"
s7350,TV Show,Love Rhythms - Accidental Daddy,Not Given,Pakistan,6/18/2018,2016,TV-MA,1 Season,"International TV Shows, TV Comedies, TV Dramas"
s7393,TV Show,Man vs Wild with Sunny Leone,Not Given,Pakistan,12-01-2018,2018,TV-PG,1 Season,"International TV Shows, Reality TV, TV Action & Adventure"
s7439,TV Show,Melodies of Life - Born This Way,Not Given,Pakistan,6/21/2019,2016,TV-14,1 Season,"International TV Shows, Romantic TV Shows, TV Comedies"
